GSLGE,State and local government educational services,0,0,0,0,0,0,0,0,0,0,0,0,0,0,0,0,0,0,0,0,0,0,0,0,0,0,0,0,0,0,0,0,0,0,0,0,0,0,0,0,0,0,0,0,0,0,0,0,0,0,0,0,0,0,0,0,0,0,0,0,0,0,0,0,0,0,0,0,0,0,0,0,0,0,0,0,0,0,0,0,0,0,0,0,0,0,0,0,0,0,0,0,0,0,0,0,0,0,0,0,0,0,0,0,0,0,0,0,0,0,0,0,0,0,0,0,0,0,0,0,0,0,0,0,0,0,0,0,0,0,0,0,0,0,0,0,0,0
GSLGH,State and local government hospitals and health services,0,0,0,0,0,0,0,0,0,0,0,0,0,0,0,0,0,0,0,0,0,0,0,0,0,0,0,0,0,0,0,0,0,0,0,0,0,0,0,0,0,0,0,0,0,0,0,0,0,0,0,0,0,0,0,0,0,0,0,0,0,0,0,0,0,0,0,0,0,0,0,0,0,0,0,0,0,0,0,0,0,0,0,0,0,0,0,0,0,0,0,0,0,0,0,0,0,0,0,0,0,0,0,0,0,0,0,0,0,0,0,0,0,0,0,0,0,0,0,0,0,0,0,0,0,0,0,0,0,0,0,0,0,0,0,0,0,0
GSLGO,State and local government other services,0,0,0,0,0,0,0,0,0,0,0,0,0,0,0,0,0,0,0,0,0,0,0,0,0,0,0,0,0,0,0,0,0,0,0,0,0,0,0,0,0,0,0,0,0,0,0,0,0,0,0,0,0,0,0,0,0,0,0,0,0,0,0,0,0,0,0,0,0,0,0,0,0,0,0,0,0,0,0,0,0,0,0,0,0,0,0,0,0,0,0,0,0,0,0,0,0,0,0,0,0,0,0,0,0,0,0,0,0,0,0,0,0,0,0,0,0,0,0,0,0,0,0,0,0,0,0,0,0,0,0,0,0,0,0,0,0,0
GSLE,State and local government enterprises,0,0,0,0,0,0,0,0,0,0,0,0,0,0,0,0,0,0,0,0,0,0,0,0,0,0,0,0,0,0,0,0,0,0,0,0,0,0,0,0,0,0,0,0,0,0,0,0,0,0,0,0,0,0,0,0,0,0,0,0,0,0,0,0,0,0,0,0,0,0,0,0,0,0,0,0,0,0,0,0,0,0,0,0,0,0,0,0,0,0,0,0,0,0,0,0,0,0,0,0,0,0,0,0,0,0,0,0,0,0,0,0,0,0,0,0,0,0,0,0,0,0,0,0,0,0,0,0,0,0,0,0,0,0,0,0,0,0
Used,"Scrap, used and secondhand goods",0,0,0,0,0,0,6,1,0,0,0,0,0,0,9,0,0,5,7,276,2,0,0,0,0,0,0,0,0,0,0,0,0,0,0,0,0,0,0,0,0,0,0,1,0,105,0,0,0,0,0,2,4,0,0,0,0,0,0,0,0,0,0,0,9,0,0,0,0,0,0,0,0,0,0,0,0,0,0,-103,0,0,0,0,0,0,0,0,0,0,0,0,0,0,0,0,0,0,0,0,0,0,0,0,0,0,0,0,0,68,0,0,0,0,-28,0,0,0,0,0,0,0,0,0,36,0,0,9,0,0,0,0,0,0,0,0,0,0
Other,Noncomparable imports and rest-of-the-world adjustment,38,39,5,171,1,16,171,11,6,0,13,65,13,21,49,28,27,26,50,24,65,16,13,11,79,1,88,18,30,1,31,28,117,8,61,38,4,10,26,14,109,24,47,10,1,58,24,877,89,25,38,41,68,51,105,127,107,129,38,90,171,100,69,0,13,52,103,0,19,13,28,1666,13,2121,13,163,148,2,12,60,9,12,18,66,50,19,256,413,52,63,29,358,7654,14,26,87,5,0,19,66,275,16,262,14,118,108,49,46,44,209,76,44,47,9,41,0,0,0,0,0,0,35,0,37,30,62,269,21,178,0,0,1911,566,1,0,0,0,0

Legend/Footnotes
"The TiVA services trade statistics consist primarily of statistics published in <a href=""https://apps.bea.gov/iTable/?reqid=62&amp;step=9&amp;isuri=1&amp;product=4"">BEAs U.S. Trade in Services statistics</a>, Table 2.3. U.S. Trade in Services, by Country or Affiliation and by Type of Service. Because some cells in BEAs trade in services table are suppressed, the TiVA statistics include imputed values for the suppressed cells. The methodology used to impute suppressed cell values relied on information from surrounding cells in the published Table 2.3. No information on the underlying suppressed values was used for imputation."
"The TiVA goods trade statistics consist of statistics publicly available through the U.S. Census Bureaus online database, <a href=""https://usatrade.census.gov/"">USA Trade Online.</a>"
