"Import Matrix, Rest of World, After Redefinitions"
"Import Matrix, Rest of World, After Redefinitions"
"March 16, 2023"
IOCode,Commodities/Industries,111,112,113FF,211,212,213,2211,2212NW,23EH,23MR,23OC,23OR,23OT,23PC,23SF,23TH,321,327,3311IS,3313NF,332,33311,33312,33313,3332OM,3341,3342,3344,3345,334X,335,336111,336112,33612,3362BP,3364,3365AO,337,3391,3399,311,3121,3122,313TT,315AL,322,323,324,3251,3252,3254,325X,326,4231,4234,4236,4238,423X,4242,4244,4247,424X,425,42ID,441,445,452,444,446,447,448,454,4A0X,481,482,483,484,485,486,48A,492,493,5111,5112,512,515,5171,5172,5174OT,518,519,521CI,523,524113,5241XX,5242,525,HSO,HST,ORE,532RL,5411,5415,5412,5413,5416,5417,5418,541X,55,5613,5617,561X,562,61,6211,6212,6213,6214,6215OH,622,623,624,711AS,713,721,722,811,812,813,814,GFGD,GFGN,GFE,GSLGE,GSLGH,GSLGO,GSLE
IOCode,Name,Crop production,Animal production and aquaculture,"Forestry, fishing, and related activities",Oil and gas extraction,"Mining, except oil and gas",Support activities for mining,"Electric power generation, transmission, and distribution","Natural gas distribution and water, sewage and other systems","Education, hospital, and health structures",Maintenance and repair construction,Office and commercial structures,Other residential construction,Other nonresidential structures,Power and communication structures,Single-family residential structures,Transportation structures and highways and streets,Wood products,Nonmetallic mineral products,Iron and steel mills and manufacturing from purchased steel,Nonferrous metal production and processing and foundries,Fabricated metal products,Agricultural implement manufacturing,Construction machinery manufacturing,Mining and oil and gas field machinery manufacturing,Other machinery,Computer and peripheral equipment manufacturing,Communications equipment manufacturing,Semiconductor and other electronic component manufacturing,"Navigational, measuring, electromedical, and control instruments manufacturing",Other computer and electronic product manufacturing,"Electrical equipment, appliances, and components",Automobile manufacturing,Light truck and utility vehicle manufacturing,Heavy duty truck manufacturing,"Motor vehicle body, trailer, and parts manufacturing",Aerospace product and parts manufacturing,All other transportation equipment manufacturing,Furniture and related products,Medical equipment and supplies manufacturing,Other miscellaneous manufacturing,Food manufacturing,Beverage manufacturing,Tobacco product manufacturing,Textile mills and textile product mills,Apparel and leather and allied products,Paper products,Printing and related support activities,Petroleum and coal products,Basic chemical manufacturing,"Resin, rubber, and artificial fibers manufacturing",Pharmaceutical and medicine manufacturing,Other chemical manufacturing,Plastics and rubber products,Motor vehicle and motor vehicle parts and supplies merchant wholesalers,Professional and commercial equipment and supplies merchant wholesalers,Household appliances and electrical and electronic goods merchant wholesalers,"Machinery, equipment, and supplies merchant wholesalers",Other durable goods merchant wholesalers,Drugs and druggists sundries merchant wholesalers,Grocery and related products merchant wholesalers,Petroleum and petroleum products merchant wholesalers,Other nondurable goods merchant wholesalers,Wholesale electronic markets and agents and brokers,Customs duties,Motor vehicle and parts dealers,Food and beverage stores,General merchandise stores,Building material and garden equipment and supplies dealers,Health and personal care stores,Gasoline stations,Clothing and clothing accessories stores,Nonstore retailers,All other retail,Air transportation,Rail transportation,Water transportation,Truck transportation,Transit and ground passenger transportation,Pipeline transportation,Scenic and sightseeing transportation and support activities,Couriers and messengers,Warehousing and storage,"Newspaper, periodical, book, and directory publishers",Software publishers,Motion picture and sound recording industries,Broadcasting (except Internet),Wired telecommunications carriers,Wireless telecommunications carriers (except satellites),"Other telecommunications, including satellite","Data processing, hosting, and related services",Other information services,"Federal Reserve banks, credit intermediation, and related activities","Securities, commodity contracts, and investments",Direct life insurance carriers,"Insurance Carriers, except Direct Life Insurance","Agencies, brokerages, and other insurance related activities","Funds, trusts, and other financial vehicles",Owner-occupied housing,Tenant-occupied housing,Other real estate,Rental and leasing services and lessors of intangible assets,Legal services,Computer systems design and related services,"Accounting, tax preparation, bookkeeping, and payroll services","Architectural, engineering, and related services","Management, scientific, and technical consulting services",Scientific research and development services,"Advertising, public relations, and related services","Specialized design services and other professional, scientific, and technical services",Management of companies and enterprises,Employment services,Services to buildings and dwellings,Other administrative and support services,Waste management and remediation services,Educational services,Offices of physicians,Offices of dentists,Offices of other health practitioners,Outpatient care centers,Other ambulatory health care services,Hospitals,Nursing and residential care facilities,Social assistance,"Performing arts, spectator sports, museums, and related activities","Amusements, gambling, and recreation industries",Accommodation,Food services and drinking places,Repair and maintenance,Personal and laundry services,"Religious, grantmaking, civic, professional, and similar organizations",Private households,Federal general government (defense),Federal general government (nondefense),Federal government enterprises,State and local government educational services,State and local government hospitals and health services,State and local government other services,State and local government enterprises
111,Crop production,261,18,3,0,0,0,0,0,0,2,0,7,0,0,5,0,0,0,0,0,0,0,0,0,0,0,0,0,0,0,0,0,0,0,0,0,0,0,0,7,6931,480,48,2,0,0,0,0,37,0,1,0,0,0,0,0,0,0,0,0,0,1,0,0,15,11,0,0,0,19,0,0,0,0,0,0,0,0,0,14,0,0,0,0,0,0,0,0,0,0,0,0,0,0,0,0,0,0,0,0,0,0,0,1,1,1,1,2,0,0,0,45,0,0,12,0,0,0,0,0,0,0,0,0,2,2,26,0,0,3,0,0,31,0,24,20,83,0
112,Animal production and aquaculture,0,2,4,0,0,0,0,0,0,0,0,0,0,0,0,0,0,0,0,0,0,0,0,0,0,0,0,0,0,0,0,0,0,0,0,0,0,0,0,0,1138,0,0,1,0,0,0,0,0,0,0,0,0,0,0,0,0,0,0,0,0,0,0,0,0,0,1,0,0,0,0,0,0,0,0,0,0,0,0,0,0,0,0,0,0,0,0,0,0,0,0,0,0,0,0,0,0,0,0,0,0,0,0,0,0,0,75,0,0,0,0,0,0,0,2,0,0,0,0,0,0,0,0,0,10,1,936,0,0,0,0,1,0,0,0,0,0,0
113FF,"Forestry, fishing, and related activities",20,3,2,0,0,0,0,0,0,0,0,0,0,0,0,0,13,0,0,0,0,0,0,0,0,0,0,0,0,0,0,0,0,0,0,0,0,8,0,28,1502,4,0,0,3,5,6,3,19,1,0,31,223,0,0,0,0,0,0,0,0,0,0,0,0,216,0,0,0,0,0,0,0,0,0,0,0,0,0,3,0,0,0,0,0,0,0,0,0,0,0,0,0,0,0,0,0,0,0,0,0,0,0,0,0,0,6,0,0,0,0,1,0,0,18,0,0,0,0,0,0,0,0,0,54,92,1216,0,0,47,0,0,0,4,19,71,57,0
211,Oil and gas extraction,0,0,0,1256,0,0,43,59,0,0,0,0,0,0,0,0,0,0,0,0,0,0,0,0,0,0,0,0,0,0,0,0,0,0,0,0,0,0,0,0,0,0,0,0,0,0,0,35678,106,0,0,0,0,0,0,0,0,0,0,0,0,0,0,0,0,0,0,0,0,0,0,0,0,0,0,0,0,0,0,0,0,0,0,0,0,0,0,0,0,0,0,0,0,0,0,0,0,0,0,0,0,0,0,0,0,0,0,0,0,0,0,0,0,0,0,0,0,0,0,0,0,0,0,0,0,0,1,0,0,0,0,0,0,2,0,0,0,60
212,"Mining, except oil and gas",105,4,0,1,58,0,67,8,1,11,11,16,6,2,14,11,0,89,827,101,41,0,0,0,12,0,0,0,0,0,22,0,0,0,16,0,0,0,1,36,15,0,0,0,0,9,0,13,390,0,0,138,0,0,0,0,0,5,0,0,0,0,0,0,0,0,0,0,0,0,2,0,0,0,0,0,0,0,0,0,0,0,0,0,0,0,0,0,0,0,1,0,0,0,0,0,0,0,0,0,0,0,0,0,18,0,84,0,0,1,0,0,0,0,0,0,0,0,0,0,0,0,0,0,0,0,2,0,0,0,0,0,23,0,2,1,286,35
213,Support activities for mining,0,0,0,98,16,13,0,0,0,0,0,0,0,0,0,0,0,0,0,0,0,0,0,0,0,0,0,0,0,0,0,0,0,0,0,0,0,0,0,0,0,0,0,0,0,0,0,0,0,0,0,0,0,0,0,0,0,0,0,0,0,0,0,0,0,0,0,0,0,0,0,0,0,0,0,0,0,0,0,0,0,0,0,0,0,0,0,0,0,0,0,0,0,0,0,0,0,0,0,0,0,0,0,0,0,0,1,0,0,0,0,0,0,0,0,0,0,0,0,0,0,0,0,0,0,0,0,0,0,0,0,0,0,0,0,0,0,0
2211,"Electric power generation, transmission, and distribution",0,0,0,0,0,0,11,0,0,0,0,0,0,0,0,0,0,0,0,0,0,0,0,0,0,0,0,0,0,0,0,0,0,0,0,0,0,0,0,0,0,0,0,0,0,0,0,0,0,0,0,0,0,0,0,0,0,0,0,0,0,0,0,0,0,0,0,0,0,0,0,0,0,0,0,0,0,0,0,0,0,0,0,0,0,0,0,0,0,0,0,1,0,0,0,0,0,0,0,0,0,0,0,0,0,0,0,0,0,0,0,0,0,0,0,0,0,0,0,0,0,0,0,0,0,0,0,0,0,0,0,0,0,0,0,0,0,0
2212NW,"Natural gas distribution and water, sewage and other systems",0,0,0,0,0,0,0,0,0,0,0,0,0,0,0,0,0,0,0,0,0,0,0,0,0,0,0,0,0,0,0,0,0,0,0,0,0,0,0,0,0,0,0,0,0,0,0,0,0,0,0,0,0,0,0,0,0,0,0,0,0,0,0,0,0,0,0,0,0,0,0,0,0,0,0,0,0,0,0,0,0,0,0,0,0,0,0,0,0,0,0,0,0,0,0,0,0,0,0,0,0,0,0,0,0,0,0,0,0,0,0,0,0,0,0,0,0,0,0,0,0,0,0,0,0,0,0,0,0,0,0,0,0,0,0,0,0,0
23EH,"Education, hospital, and health structures",0,0,0,0,0,0,0,0,0,0,0,0,0,0,0,0,0,0,0,0,0,0,0,0,0,0,0,0,0,0,0,0,0,0,0,0,0,0,0,0,0,0,0,0,0,0,0,0,0,0,0,0,0,0,0,0,0,0,0,0,0,0,0,0,0,0,0,0,0,0,0,0,0,0,0,0,0,0,0,0,0,0,0,0,0,0,0,0,0,0,0,0,0,0,0,0,0,0,0,0,0,0,0,0,0,0,0,0,0,0,0,0,0,0,0,0,0,0,0,0,0,0,0,0,0,0,0,0,0,0,0,0,0,0,0,0,0,0
23MR,Maintenance and repair construction,0,0,0,0,0,0,0,0,0,0,0,0,0,0,0,0,0,0,0,0,0,0,0,0,0,0,0,0,0,0,0,0,0,0,0,0,0,0,0,0,0,0,0,0,0,0,0,0,0,0,0,0,0,0,0,0,0,0,0,0,0,0,0,0,0,0,0,0,0,0,0,0,0,0,0,0,0,0,0,0,0,0,0,0,0,0,0,0,0,0,0,0,0,0,0,0,0,0,0,0,0,0,0,0,0,0,0,0,0,0,0,0,0,0,0,0,0,0,0,0,0,0,0,0,0,0,0,0,0,0,0,0,0,0,0,0,0,0
23OC,Office and commercial structures,0,0,0,0,0,0,0,0,0,0,0,0,0,0,0,0,0,0,0,0,0,0,0,0,0,0,0,0,0,0,0,0,0,0,0,0,0,0,0,0,0,0,0,0,0,0,0,0,0,0,0,0,0,0,0,0,0,0,0,0,0,0,0,0,0,0,0,0,0,0,0,0,0,0,0,0,0,0,0,0,0,0,0,0,0,0,0,0,0,0,0,0,0,0,0,0,0,0,0,0,0,0,0,0,0,0,0,0,0,0,0,0,0,0,0,0,0,0,0,0,0,0,0,0,0,0,0,0,0,0,0,0,0,0,0,0,0,0
23OR,Other residential construction,0,0,0,0,0,0,0,0,0,0,0,0,0,0,0,0,0,0,0,0,0,0,0,0,0,0,0,0,0,0,0,0,0,0,0,0,0,0,0,0,0,0,0,0,0,0,0,0,0,0,0,0,0,0,0,0,0,0,0,0,0,0,0,0,0,0,0,0,0,0,0,0,0,0,0,0,0,0,0,0,0,0,0,0,0,0,0,0,0,0,0,0,0,0,0,0,0,0,0,0,0,0,0,0,0,0,0,0,0,0,0,0,0,0,0,0,0,0,0,0,0,0,0,0,0,0,0,0,0,0,0,0,0,0,0,0,0,0
23OT,Other nonresidential structures,0,0,0,0,0,0,0,0,0,0,0,0,0,0,0,0,0,0,0,0,0,0,0,0,0,0,0,0,0,0,0,0,0,0,0,0,0,0,0,0,0,0,0,0,0,0,0,0,0,0,0,0,0,0,0,0,0,0,0,0,0,0,0,0,0,0,0,0,0,0,0,0,0,0,0,0,0,0,0,0,0,0,0,0,0,0,0,0,0,0,0,0,0,0,0,0,0,0,0,0,0,0,0,0,0,0,0,0,0,0,0,0,0,0,0,0,0,0,0,0,0,0,0,0,0,0,0,0,0,0,0,0,0,0,0,0,0,0
23PC,Power and communication structures,0,0,0,0,0,0,0,0,0,0,0,0,0,0,0,0,0,0,0,0,0,0,0,0,0,0,0,0,0,0,0,0,0,0,0,0,0,0,0,0,0,0,0,0,0,0,0,0,0,0,0,0,0,0,0,0,0,0,0,0,0,0,0,0,0,0,0,0,0,0,0,0,0,0,0,0,0,0,0,0,0,0,0,0,0,0,0,0,0,0,0,0,0,0,0,0,0,0,0,0,0,0,0,0,0,0,0,0,0,0,0,0,0,0,0,0,0,0,0,0,0,0,0,0,0,0,0,0,0,0,0,0,0,0,0,0,0,0
23SF,Single-family residential structures,0,0,0,0,0,0,0,0,0,0,0,0,0,0,0,0,0,0,0,0,0,0,0,0,0,0,0,0,0,0,0,0,0,0,0,0,0,0,0,0,0,0,0,0,0,0,0,0,0,0,0,0,0,0,0,0,0,0,0,0,0,0,0,0,0,0,0,0,0,0,0,0,0,0,0,0,0,0,0,0,0,0,0,0,0,0,0,0,0,0,0,0,0,0,0,0,0,0,0,0,0,0,0,0,0,0,0,0,0,0,0,0,0,0,0,0,0,0,0,0,0,0,0,0,0,0,0,0,0,0,0,0,0,0,0,0,0,0
23TH,Transportation structures and highways and streets,0,0,0,0,0,0,0,0,0,0,0,0,0,0,0,0,0,0,0,0,0,0,0,0,0,0,0,0,0,0,0,0,0,0,0,0,0,0,0,0,0,0,0,0,0,0,0,0,0,0,0,0,0,0,0,0,0,0,0,0,0,0,0,0,0,0,0,0,0,0,0,0,0,0,0,0,0,0,0,0,0,0,0,0,0,0,0,0,0,0,0,0,0,0,0,0,0,0,0,0,0,0,0,0,0,0,0,0,0,0,0,0,0,0,0,0,0,0,0,0,0,0,0,0,0,0,0,0,0,0,0,0,0,0,0,0,0,0
321,Wood products,0,0,0,0,0,3,0,0,43,368,358,392,86,25,658,74,474,5,0,0,8,0,0,0,20,0,0,0,0,0,0,0,0,0,188,0,10,359,4,30,1,0,0,7,0,74,0,0,0,0,0,0,40,1,1,1,2,4,1,2,8,2,0,0,1,2,1,0,1,1,4,2,4,0,160,0,0,0,0,0,0,9,1,0,2,1,7,21,0,100,5,3,0,0,0,0,0,8,32,160,13,1,1,0,3,0,4,1,4,0,0,2,7,0,2,4,1,0,0,1,16,0,29,0,5,32,73,1,0,22,0,0,1,0,91,0,25,4
327,Nonmetallic mineral products,0,0,0,25,1,6,0,0,71,25,130,75,30,7,151,15,11,189,48,3,103,8,0,7,45,1,0,2,1,0,16,2,26,2,31,2,5,16,10,30,27,92,0,2,0,1,0,19,0,2,2,26,22,0,0,0,0,1,0,0,0,0,0,0,12,3,0,1,0,0,3,26,10,0,0,0,1,0,0,0,1,57,0,0,0,11,23,19,0,12,0,0,1,0,0,0,0,1,0,0,8,0,0,0,10,3,11,2,2,1,0,8,5,5,1,2,1,2,0,3,34,2,3,0,1,0,36,7,0,1,0,1,13,0,11,119,8,13
3311IS,Iron and steel mills and manufacturing from purchased steel,5,4,0,84,14,33,0,0,5,46,31,28,21,9,32,2,10,19,3852,250,1231,97,124,64,454,0,0,0,6,0,104,0,83,3,446,128,75,121,20,55,0,0,0,13,0,2,1,0,21,0,0,0,25,1,1,0,0,26,0,0,0,1,1,0,0,0,0,0,0,0,0,0,0,0,0,0,0,0,0,7,0,0,0,0,0,0,1,0,0,1,10,0,0,0,0,0,0,0,0,108,2,0,0,8,40,0,12,1,0,2,0,6,4,12,4,0,0,1,0,1,0,0,9,0,3,0,1,2,0,4,0,0,0,0,0,0,0,3
3313NF,Nonferrous metal production and processing and foundries,0,0,0,0,0,0,0,0,0,8,1,6,1,6,9,1,51,13,1583,7362,1584,3,3,2,556,1,1,348,19,0,1854,1,422,17,776,21,243,138,436,909,0,231,1,0,0,35,0,28,0,0,0,0,13,0,0,0,0,36,0,0,0,0,15,0,0,0,0,0,0,0,5,0,0,0,0,0,0,0,0,0,0,0,2,0,1,3,2,0,3,7,46,0,0,0,0,0,0,0,0,0,1,0,0,0,212,0,57,0,0,4,0,0,3,0,0,0,0,0,0,0,0,0,0,0,0,0,4,16,0,0,0,19,101,0,0,0,0,116
332,Fabricated metal products,4,18,1,56,1,1,0,3,12,72,84,101,51,27,148,45,13,2,6,1,108,5,23,2,82,0,0,1,2,0,10,2,34,2,53,8,21,6,2,5,123,70,17,1,0,17,1,5,14,3,1,56,14,0,3,0,0,1,0,0,1,3,0,0,1,0,0,0,0,1,1,1,2,0,1,1,1,1,0,1,1,1,1,0,0,19,12,11,0,6,6,0,0,0,0,0,0,2,0,20,4,0,7,1,25,1,12,1,0,3,0,10,35,13,4,0,0,0,0,0,4,0,9,0,5,5,19,9,0,5,0,80,9,0,4,5,18,18
33311,Agricultural implement manufacturing,28,9,0,0,0,0,0,0,0,0,0,0,0,0,0,0,0,0,0,0,0,6,0,0,0,0,0,0,0,0,0,0,0,0,0,0,0,0,0,0,0,0,0,0,0,0,0,0,0,0,0,0,0,0,0,0,0,1,0,0,0,0,0,0,0,0,0,0,0,0,0,0,0,0,0,0,0,0,0,0,0,0,0,0,0,0,0,0,0,0,0,0,0,0,0,0,0,0,0,0,0,0,0,0,0,0,1,0,0,0,0,0,0,1,0,0,0,0,0,0,0,0,0,0,0,0,0,0,0,0,0,0,0,0,12,0,2,3
33312,Construction machinery manufacturing,0,0,0,8,17,7,0,0,0,2,0,20,1,2,9,0,0,0,0,0,0,0,2,0,0,0,0,0,0,0,0,0,0,0,0,0,1,0,0,0,0,0,0,0,0,0,0,0,0,0,0,0,0,0,0,0,0,0,0,0,0,0,0,0,0,0,0,0,0,0,0,0,0,0,0,0,0,0,0,0,0,0,0,0,0,0,0,0,0,0,0,0,0,0,0,0,0,0,0,0,0,0,0,0,2,0,0,0,0,0,0,0,0,6,0,0,0,0,0,0,0,0,0,0,0,0,0,0,0,0,0,0,0,0,0,0,0,0
33313,Mining and oil and gas field machinery manufacturing,0,0,0,19,10,5,0,0,0,0,0,0,0,0,0,0,0,0,0,0,0,0,0,0,0,0,0,0,0,0,0,0,0,0,0,0,0,0,0,0,0,0,0,0,0,0,0,0,0,0,0,0,0,0,0,0,0,0,0,0,0,0,0,0,0,0,0,0,0,0,0,0,0,0,0,0,0,0,0,0,0,0,0,0,0,0,0,0,0,0,0,0,0,0,0,0,0,0,0,0,0,0,0,0,1,0,0,0,0,0,0,0,0,5,0,0,0,0,0,0,0,0,0,0,0,0,0,0,0,0,0,0,0,0,0,0,0,0
3332OM,Other machinery,4,3,7,169,9,98,121,1,16,9,281,18,114,1,11,4,4,2,2,2,36,69,45,35,411,0,0,1,1,0,47,9,293,72,87,7,20,0,2,6,4,9,0,0,-3,11,39,2,4,2,0,21,18,0,1,0,27,1,0,1,0,1,1,0,1,3,3,0,0,5,0,1,0,0,1,0,2,8,1,23,0,1,0,0,0,0,1,4,0,0,0,0,0,0,1,0,0,0,0,0,1,0,14,1,16,1,13,0,8,1,0,40,5,41,9,10,0,0,0,5,3,0,0,0,0,0,5,68,4,1,0,14,17,-30,17,4,32,48
3341,Computer and peripheral equipment manufacturing,0,0,0,0,0,0,0,0,0,0,0,0,0,0,0,0,0,0,0,0,0,0,0,0,1,2,0,0,0,0,0,0,1,0,0,0,0,0,0,0,0,0,0,0,0,0,0,0,0,0,0,0,0,0,0,0,0,0,0,0,0,0,0,0,0,1,1,0,0,0,0,1,0,0,0,0,0,0,0,0,0,0,0,0,0,0,2,1,0,1,1,0,2,0,0,0,1,0,0,1,0,2,2,1,1,3,1,2,2,10,1,1,1,0,1,0,0,0,0,0,0,0,1,0,0,0,0,0,0,1,0,0,0,0,3,1,1,0
3342,Communications equipment manufacturing,0,0,0,0,0,0,0,0,2,1,0,2,0,0,0,1,0,0,0,0,0,0,0,0,1,0,11,1,5,0,0,0,0,0,0,16,0,0,0,0,0,0,0,0,0,0,0,0,0,0,0,0,0,0,0,0,0,0,0,0,1,0,0,0,0,0,0,0,0,0,0,2,0,0,0,0,0,0,0,0,0,0,1,0,0,3,22,46,4,3,1,0,0,0,0,0,0,1,0,0,0,1,0,1,0,0,0,0,0,45,1,0,2,0,1,1,0,0,0,0,0,0,0,0,0,0,0,4,0,0,0,101,4,0,3,0,0,0
3344,Semiconductor and other electronic component manufacturing,0,0,0,0,0,0,0,0,0,0,0,1,0,0,4,1,5,7,2,7,33,7,5,3,61,9,3,42,17,0,46,3,89,1,121,30,4,7,5,8,5,14,0,5,1,-9,11,2,5,3,0,18,11,19,-1,12,15,24,2,0,1,33,4,0,2,0,0,0,5,0,0,0,0,0,0,0,0,0,0,0,0,0,0,26,0,0,34,55,11,36,0,2,5,0,0,0,0,0,0,0,0,0,51,1,3,0,22,0,2,0,0,0,11,0,3,0,0,0,0,0,2,1,0,0,0,0,0,70,0,0,0,3,11,0,2,0,1,0
3345,"Navigational, measuring, electromedical, and control instruments manufacturing",0,0,0,0,0,0,1,0,1,5,7,14,1,0,3,0,2,0,0,0,7,0,0,0,10,0,0,4,47,0,-1,0,0,0,0,2,3,0,4,0,0,0,0,0,0,0,1,1,10,3,0,0,1,0,0,0,0,0,0,0,0,0,0,0,1,0,0,0,0,0,0,0,0,0,0,0,0,0,0,0,0,0,0,0,0,0,0,0,0,0,1,0,0,0,0,0,0,0,0,1,-4,1,4,1,22,0,4,0,7,0,1,0,2,12,1,135,26,0,17,10,9,1,0,0,0,0,0,3,0,-5,0,16,80,0,0,-4,-1,41
334X,Other computer and electronic product manufacturing,0,0,0,0,0,0,0,0,0,0,0,0,0,0,0,0,0,0,0,0,0,0,0,0,0,0,0,0,0,0,0,1,13,0,0,0,0,0,0,0,0,0,0,0,0,0,0,0,0,0,0,0,0,0,0,0,0,0,0,0,0,0,0,0,0,0,0,0,0,0,0,0,0,0,0,0,0,0,0,0,0,0,0,0,1,0,0,0,0,0,0,0,0,0,0,0,0,0,0,0,0,2,0,1,0,0,0,2,5,0,0,0,2,0,1,0,0,0,0,0,0,0,0,0,0,1,0,0,0,0,0,0,1,0,2,0,0,0
335,"Electrical equipment, appliances, and components",4,1,7,0,0,0,0,0,9,184,109,164,58,48,165,19,3,2,6,4,37,5,7,1,264,3,1,8,10,0,138,0,8,1,78,28,10,1,15,2,12,4,0,1,0,8,2,2,8,4,0,2,24,0,0,0,0,0,0,0,0,0,0,0,6,2,3,3,0,3,1,5,1,0,0,0,1,0,0,1,0,0,0,0,0,0,66,206,9,14,0,1,3,0,0,1,0,0,1,7,5,0,30,29,85,2,14,0,167,1,15,10,110,15,5,0,0,0,0,0,7,1,7,0,1,1,52,106,0,4,0,16,49,1,31,4,1,36
336111,Automobile manufacturing,0,0,0,0,0,0,0,0,0,0,0,0,0,0,0,0,0,0,0,0,0,0,0,0,0,0,0,0,0,0,0,0,0,0,0,0,0,0,0,0,0,0,0,0,0,0,0,0,0,0,0,0,0,0,0,0,0,0,0,0,0,0,0,0,0,0,0,0,0,0,0,0,0,0,0,0,0,0,0,0,0,0,0,0,0,0,0,0,0,0,0,0,0,0,0,0,0,0,0,0,0,0,0,0,0,0,0,0,0,0,0,0,0,0,0,0,0,0,0,0,0,0,0,0,0,0,0,0,0,0,0,0,0,0,0,0,0,0
336112,Light truck and utility vehicle manufacturing,0,0,0,0,0,0,0,0,0,0,0,0,0,0,0,0,0,0,0,0,0,0,0,0,0,0,0,0,0,0,0,0,0,0,0,0,0,0,0,0,0,0,0,0,0,0,0,0,0,0,0,0,0,0,0,0,0,0,0,0,0,0,0,0,0,0,0,0,0,0,0,0,0,0,0,0,0,0,0,0,0,0,0,0,0,0,0,0,0,0,0,0,0,0,0,0,0,0,0,0,0,0,0,0,0,0,0,0,0,0,0,0,0,0,0,0,0,0,0,0,0,0,0,0,0,0,0,0,0,0,0,0,0,0,0,0,0,0
33612,Heavy duty truck manufacturing,0,0,0,0,0,0,0,0,0,0,0,0,0,0,0,0,0,0,0,0,0,0,0,0,0,0,0,0,0,0,0,0,0,1,0,0,0,0,0,0,0,0,0,0,0,0,0,0,0,0,0,0,0,0,0,0,0,0,0,0,0,0,0,0,0,0,0,0,0,0,0,0,0,0,0,0,0,0,0,0,0,0,0,0,0,0,0,0,0,0,0,0,0,0,0,0,0,0,0,0,0,0,0,0,0,0,0,0,0,0,0,0,0,0,0,0,0,0,0,0,0,0,0,0,0,0,0,0,0,0,0,0,0,0,0,0,0,0
3362BP,"Motor vehicle body, trailer, and parts manufacturing",14,7,1,7,3,1,0,0,0,26,0,0,0,0,0,0,4,4,2,1,5,37,19,1,50,0,0,1,1,0,2,37,724,23,197,1,14,2,1,1,9,3,0,0,0,6,1,1,1,1,0,4,3,15,1,3,10,26,1,22,6,10,16,0,30,18,2,18,9,2,1,37,3,0,0,0,18,4,0,0,0,68,4,0,1,4,0,1,0,0,5,0,0,0,0,0,0,0,0,0,15,0,0,0,9,11,15,13,4,13,2,93,19,13,6,1,0,0,0,3,25,3,19,0,1,1,9,170,3,5,0,36,2,3,32,2,35,9
3364,Aerospace product and parts manufacturing,0,0,0,0,0,0,0,0,0,0,0,0,0,0,0,0,0,0,0,0,0,0,0,0,0,0,0,0,0,0,0,0,0,0,0,498,0,0,0,0,0,0,0,0,0,0,0,0,0,0,0,0,0,0,0,0,0,0,0,0,0,0,0,0,0,0,0,0,0,0,0,0,0,0,0,0,0,0,0,15,22,0,0,0,0,0,0,0,0,0,0,0,0,0,0,0,0,0,0,0,0,0,0,0,0,0,0,0,0,0,0,0,0,0,0,0,0,0,0,0,0,0,0,0,0,0,0,0,0,0,0,102,5,0,0,0,0,0
3365AO,All other transportation equipment manufacturing,0,0,0,0,0,0,0,0,0,0,0,0,0,0,0,0,0,0,0,0,0,0,0,0,0,0,0,0,0,0,0,0,0,0,0,0,15,0,0,0,0,0,0,0,0,0,0,0,0,0,0,0,0,0,0,0,0,0,0,0,0,0,0,0,0,0,0,0,0,0,0,0,0,0,3,0,0,0,0,1,0,0,0,0,0,0,0,0,0,0,0,0,0,0,0,0,0,0,0,0,0,0,0,0,0,0,0,0,0,0,0,0,0,0,0,0,0,0,0,0,0,0,0,0,0,0,0,2,0,0,0,0,0,0,0,0,0,0
337,Furniture and related products,0,0,0,0,0,0,0,0,0,0,0,0,0,0,0,0,1,0,0,0,0,0,0,0,0,0,0,0,0,0,0,0,0,0,0,0,0,28,0,0,0,0,0,0,0,0,0,0,0,0,0,0,0,0,0,0,0,2,0,6,0,1,0,0,2,0,0,0,0,0,5,4,19,0,0,0,0,0,0,0,0,0,0,0,0,0,0,0,0,0,0,0,0,0,0,0,0,16,0,0,0,0,0,0,0,0,1,0,5,0,0,0,0,0,0,0,0,0,1,5,0,0,0,1,1,0,0,0,0,0,0,0,0,0,0,0,0,0
3391,Medical equipment and supplies manufacturing,0,0,0,0,0,0,0,0,0,0,0,0,0,0,0,0,0,0,0,0,0,0,0,0,0,0,0,0,0,0,0,0,0,0,0,0,0,0,290,0,0,0,0,0,0,0,0,0,0,0,0,0,0,0,0,0,0,0,0,0,0,0,0,0,0,0,0,0,0,0,0,0,0,0,0,0,0,0,0,0,0,0,0,0,0,0,0,0,0,0,0,0,0,0,0,0,0,0,0,0,0,0,0,0,1,0,2,0,129,0,0,0,0,0,0,454,82,1,143,26,886,44,1,0,0,0,0,0,0,0,0,28,28,0,0,480,0,0
3399,Other miscellaneous manufacturing,0,0,0,0,0,0,0,0,0,0,0,1,0,0,1,0,0,1,0,0,0,0,0,2,13,0,0,0,0,0,4,0,6,0,7,0,0,0,0,64,0,0,0,0,0,0,0,0,2,0,0,0,0,0,0,0,0,1,0,1,0,0,0,0,16,1,0,1,0,0,1,14,0,0,0,0,0,0,0,0,1,3,0,0,0,0,0,0,0,5,0,0,0,0,0,0,0,0,0,5,1,0,0,3,2,1,1,2,0,0,0,31,1,0,2,0,0,0,0,0,3,0,5,0,1,0,3,6,2,0,0,0,1,0,31,-2,4,0
311,Food manufacturing,0,69,0,0,0,0,0,0,0,0,0,0,0,0,0,0,0,5,0,0,0,0,0,0,0,0,0,0,0,0,0,0,0,0,0,0,0,0,0,0,2442,331,0,0,2,21,0,8,1,0,47,85,3,0,0,0,0,0,0,0,0,5,4,0,0,22,9,0,0,0,0,0,0,15,0,3,3,0,0,0,0,0,1,0,0,0,0,0,0,0,3,0,0,0,0,0,0,0,0,0,0,0,0,0,1,0,5,0,8,0,0,0,0,0,77,0,0,0,0,0,111,53,69,0,12,35,521,0,0,19,0,36,0,7,325,281,227,0
3121,Beverage manufacturing,0,0,0,0,0,0,0,0,0,0,0,0,0,0,0,0,0,0,0,0,0,0,0,0,0,0,0,0,0,0,0,0,0,0,0,0,0,0,0,0,0,99,0,0,0,0,0,0,0,0,0,0,0,0,0,0,1,0,0,0,0,0,0,0,0,0,0,0,0,0,0,0,0,9,0,0,0,0,0,0,0,0,0,0,0,0,0,0,0,0,0,0,0,0,0,0,0,0,0,0,0,0,0,0,0,0,2,0,0,0,0,0,0,0,0,0,0,0,0,0,0,0,0,1,11,8,214,0,0,4,0,0,0,0,0,1,0,0
3122,Tobacco product manufacturing,0,0,0,0,0,0,0,0,0,0,0,0,0,0,0,0,0,0,0,0,0,0,0,0,0,0,0,0,0,0,0,0,0,0,0,0,0,0,0,0,0,0,263,0,0,0,0,0,0,0,0,0,0,0,0,0,0,0,0,0,0,0,0,0,0,0,0,0,0,0,0,0,0,0,0,0,0,0,0,0,0,0,0,0,0,0,0,0,0,0,0,0,0,0,0,0,0,0,0,0,0,0,0,0,0,0,0,0,0,0,0,0,0,0,0,0,0,0,0,0,0,0,0,0,0,0,0,0,0,0,0,0,0,0,0,0,1,0
313TT,Textile mills and textile product mills,0,0,0,0,0,0,0,0,0,8,4,3,0,0,2,0,5,3,0,0,0,0,0,0,5,0,0,0,0,0,0,1,12,2,8,0,2,56,2,3,1,0,0,74,54,20,1,1,0,0,0,0,58,1,10,17,1,13,7,3,22,5,1,0,0,3,81,0,1,0,37,3,1,0,0,0,0,0,0,0,0,0,0,0,3,0,0,0,0,0,0,0,0,0,0,0,0,0,0,0,1,0,0,0,0,0,3,0,2,0,0,3,0,2,0,1,0,0,0,1,12,39,17,0,1,19,4,0,1,1,0,1,3,0,2,21,15,0
315AL,Apparel and leather and allied products,0,0,0,0,0,0,0,0,0,0,0,0,0,0,0,0,0,0,0,0,0,0,0,0,0,0,0,0,0,0,0,3,27,0,63,0,0,0,0,1,1,0,0,0,52,0,0,-1,0,0,0,0,0,0,0,0,0,0,0,0,0,0,0,0,0,0,0,0,0,0,2,0,0,0,0,0,0,0,0,0,0,0,0,0,0,0,0,0,0,0,0,0,0,0,0,0,0,0,0,0,0,0,0,0,0,0,0,0,0,0,0,0,0,0,0,0,0,0,0,0,0,0,0,0,0,0,0,1,0,0,0,1,0,1,5,0,89,0
322,Paper products,5,0,0,0,0,0,0,0,0,1,0,1,0,0,7,0,0,1,0,0,1,0,0,0,3,0,0,0,0,0,1,0,1,0,2,0,0,0,2,1,98,1,1,1,0,1652,42,0,0,77,0,4,12,2,2,4,4,8,6,6,4,8,3,0,0,7,1,1,2,1,2,7,2,0,0,0,0,2,0,31,2,1,1,0,0,0,0,0,0,0,0,1,1,0,0,1,0,0,0,3,1,1,0,0,1,1,0,1,2,1,1,2,2,0,1,1,0,0,1,0,10,4,2,0,0,12,8,0,0,2,0,0,5,0,31,7,15,0
323,Printing and related support activities,0,0,0,0,0,0,0,0,0,0,0,0,0,0,-1,0,0,0,0,0,0,0,0,0,0,0,0,0,0,0,0,0,0,0,0,0,0,0,0,0,0,0,0,0,0,0,1,0,0,0,0,0,0,0,0,0,0,-1,1,0,-1,0,0,0,0,0,0,0,0,0,0,2,0,0,0,0,0,0,0,0,0,0,2,0,0,1,1,0,0,0,1,-1,-1,0,1,0,0,0,0,-1,0,0,0,0,0,1,0,1,0,-7,0,0,2,0,0,0,0,0,0,0,0,0,0,0,0,7,1,0,0,0,0,0,2,0,3,0,2,0
324,Petroleum and coal products,243,71,9,69,105,32,1823,11,6,80,47,83,37,25,66,44,6,7,5,1,8,0,1,0,45,0,0,0,0,0,49,0,2,0,2,2,1,1,0,1,13,2,0,2,0,40,79,601,129,73,1,112,24,8,3,3,7,25,2,12,5,18,4,0,10,8,2,8,1,2,1,5,6,613,339,101,170,7,2,128,353,4,1,1,1,0,1,2,0,2,0,25,25,0,0,0,10,0,1,58,23,0,5,1,13,1,6,1,2,31,0,173,5,95,11,1,1,0,1,1,60,6,5,1,9,14,57,7,2,38,0,435,30,29,1245,69,1454,470
3251,Basic chemical manufacturing,26,0,0,129,23,7,10,5,0,4,0,1,1,0,0,1,21,146,11,10,15,0,1,1,11,0,0,17,1,0,3,0,6,1,14,3,2,2,13,11,35,4,0,13,1,189,5,179,716,713,14,433,291,0,2,2,0,4,0,4,7,4,1,0,1,1,1,0,0,1,0,1,0,0,2,0,4,0,0,0,1,0,1,0,1,0,5,4,2,0,0,0,0,0,0,0,0,0,0,376,1,0,0,3,1,6,12,8,18,3,0,18,31,33,2,46,9,55,3,118,28,5,0,0,1,1,31,9,6,1,0,0,9,0,117,302,46,-3
3252,"Resin, rubber, and artificial fibers manufacturing",0,0,0,0,0,0,0,0,0,0,0,0,0,0,0,0,8,7,2,0,10,0,0,0,12,0,0,1,1,0,20,0,0,0,41,0,5,4,31,30,5,0,20,102,3,31,0,0,2,76,0,110,722,0,0,0,0,0,0,0,0,0,0,0,0,0,0,0,0,0,0,0,0,0,0,0,0,0,0,0,0,0,0,0,0,0,0,0,0,0,0,0,0,0,0,0,0,0,0,0,0,0,0,0,3,0,0,0,0,0,0,0,0,0,0,0,0,0,0,0,1,0,0,0,0,0,0,0,0,0,0,0,0,0,0,0,0,0
3254,Pharmaceutical and medicine manufacturing,0,2,0,0,0,0,0,0,0,242,0,0,0,0,0,0,0,0,0,0,0,0,0,0,0,0,0,0,0,0,0,0,0,0,0,0,0,0,0,0,3,0,0,0,0,0,0,0,0,0,14957,0,0,0,0,0,0,0,0,0,0,0,0,0,0,0,0,0,0,0,0,0,0,0,0,0,0,0,0,0,0,0,0,0,0,0,0,0,0,0,0,0,0,0,0,0,0,0,0,0,0,0,0,0,0,0,3740,0,49,109,0,0,0,0,0,85,1,3456,0,26,154,6,0,0,0,0,0,0,0,0,0,20,1,0,0,23,0,0
325X,Other chemical manufacturing,1420,54,199,0,36,12,0,1,22,169,113,334,94,20,361,40,1,5,1,0,89,0,0,0,1,0,0,0,0,0,1,0,7,0,4,0,1,2,2,2,34,1,0,1,1,49,26,107,103,20,1,366,20,0,0,0,2,0,0,0,0,113,7,0,0,0,0,9,0,0,0,0,0,0,1,0,0,0,0,0,0,1,1,0,30,0,0,0,0,1,8,0,0,0,0,0,0,9,0,30,0,0,0,0,1,1,55,19,19,15,0,210,0,0,6,0,1,0,4,6,24,2,4,0,8,0,1,1,14,1,0,4,37,1,38,43,390,85
326,Plastics and rubber products,15,3,0,1,8,10,0,0,3,77,25,111,14,9,75,7,8,14,10,6,35,18,7,2,59,1,0,5,4,0,28,9,249,14,73,1,18,20,47,38,88,12,0,9,3,58,24,6,24,11,3,52,258,5,6,3,11,13,12,30,2,21,7,0,10,16,3,3,5,24,3,19,7,1,0,0,9,0,1,1,2,13,4,1,2,3,5,12,1,2,1,1,2,0,0,3,0,1,5,2,10,0,1,0,7,3,10,4,3,-8,1,5,7,1,11,40,3,0,0,9,33,4,9,0,2,1,18,3,2,7,0,13,5,0,36,83,6,4
4231,Motor vehicle and motor vehicle parts and supplies merchant wholesalers,0,0,0,0,0,0,0,0,0,0,0,0,0,0,0,0,0,0,0,0,0,0,0,0,0,0,0,0,0,0,0,0,0,0,0,0,0,0,0,0,0,0,0,0,0,0,0,0,0,0,0,0,0,0,0,0,0,0,0,0,0,0,0,0,0,0,0,0,0,0,0,0,0,0,0,0,0,0,0,0,0,0,0,0,0,0,0,0,0,0,0,0,0,0,0,0,0,0,0,0,0,0,0,0,0,0,0,0,0,0,0,0,0,0,0,0,0,0,0,0,0,0,0,0,0,0,0,0,0,0,0,0,0,0,0,0,0,0
4234,Professional and commercial equipment and supplies merchant wholesalers,0,0,0,0,0,0,0,0,0,0,0,0,0,0,0,0,0,0,0,0,0,0,0,0,0,0,0,0,0,0,0,0,0,0,0,0,0,0,0,0,0,0,0,0,0,0,0,0,0,0,0,0,0,0,0,0,0,0,0,0,0,0,0,0,0,0,0,0,0,0,0,0,0,0,0,0,0,0,0,0,0,0,0,0,0,0,0,0,0,0,0,0,0,0,0,0,0,0,0,0,0,0,0,0,0,0,0,0,0,0,0,0,0,0,0,0,0,0,0,0,0,0,0,0,0,0,0,0,0,0,0,0,0,0,0,0,0,0
4236,Household appliances and electrical and electronic goods merchant wholesalers,0,0,0,0,0,0,0,0,0,0,0,0,0,0,0,0,0,0,0,0,0,0,0,0,0,0,0,0,0,0,0,0,0,0,0,0,0,0,0,0,0,0,0,0,0,0,0,0,0,0,0,0,0,0,0,0,0,0,0,0,0,0,0,0,0,0,0,0,0,0,0,0,0,0,0,0,0,0,0,0,0,0,0,0,0,0,0,0,0,0,0,0,0,0,0,0,0,0,0,0,0,0,0,0,0,0,0,0,0,0,0,0,0,0,0,0,0,0,0,0,0,0,0,0,0,0,0,0,0,0,0,0,0,0,0,0,0,0
4238,"Machinery, equipment, and supplies merchant wholesalers",0,0,0,0,0,0,0,0,0,0,0,0,0,0,0,0,0,0,0,0,0,0,0,0,0,0,0,0,0,0,0,0,0,0,0,0,0,0,0,0,0,0,0,0,0,0,0,0,0,0,0,0,0,0,0,0,0,0,0,0,0,0,0,0,0,0,0,0,0,0,0,0,0,0,0,0,0,0,0,0,0,0,0,0,0,0,0,0,0,0,0,0,0,0,0,0,0,0,0,0,0,0,0,0,0,0,0,0,0,0,0,0,0,0,0,0,0,0,0,0,0,0,0,0,0,0,0,0,0,0,0,0,0,0,0,0,0,0
423X,Other durable goods merchant wholesalers,0,0,0,0,0,0,0,0,0,0,0,0,0,0,0,0,0,0,0,0,0,0,0,0,0,0,0,0,0,0,0,0,0,0,0,0,0,0,0,0,0,0,0,0,0,0,0,0,0,0,0,0,0,0,0,0,0,0,0,0,0,0,0,0,0,0,0,0,0,0,0,0,0,0,0,0,0,0,0,0,0,0,0,0,0,0,0,0,0,0,0,0,0,0,0,0,0,0,0,0,0,0,0,0,0,0,0,0,0,0,0,0,0,0,0,0,0,0,0,0,0,0,0,0,0,0,0,0,0,0,0,0,0,0,0,0,0,0
